{
  "registry_version": "1.0.0",
  "collection_id": "toolheads",
  "name": "Toolheads",
  "definition_status": "partial",
  "policy_ids": [
    "285c0b8e91ba323da4ca083c9db837e111dafbf3143ece4d03eba8f4"
  ],
  "identity": {
    "display_name": {
      "value": "Toolheads"
    },
    "description": {
      "value": ""
    }
  },
  "metadata_layout": {
    "primary_standard": "unknown",
    "metadata_root": "$",
    "asset_name_encoding": "unknown"
  },
  "trait_mappings": [],
  "media_mappings": {},
  "social_mappings": {},
  "link_mappings": {},
  "external_resources": [],
  "license_info": {},
  "royalty_info": {},
  "normalization_rules": [],
  "indexing_notes": [
    {
      "severity": "info",
      "message": "Phase 3A Top-100 include_now (TapTools rank 19). Type: gaming. Discovery only — no final definition in this pass."
    }
  ]
}
