{
  "registry_version": "1.0.0",
  "collection_id": "virtua-cardano-island-land-deeds",
  "name": "Virtua - Cardano Island Land Deeds",
  "definition_status": "partial",
  "policy_ids": [
    "347f991d4b306919e3e7b01f1cdececa06c2e493a21a0da0931d033b"
  ],
  "identity": {
    "display_name": {
      "value": "Virtua - Cardano Island Land Deeds"
    },
    "description": {
      "value": ""
    }
  },
  "metadata_layout": {
    "primary_standard": "unknown",
    "metadata_root": "$",
    "asset_name_encoding": "unknown"
  },
  "trait_mappings": [],
  "media_mappings": {},
  "social_mappings": {},
  "link_mappings": {},
  "external_resources": [],
  "license_info": {},
  "royalty_info": {},
  "normalization_rules": [],
  "indexing_notes": [
    {
      "severity": "info",
      "message": "Phase 3A Top-100 include_now (TapTools rank 61). Type: land. Discovery only — no final definition in this pass."
    }
  ]
}
