{
  "registry_version": "1.0.0",
  "collection_id": "dynamic-cip68-avatars",
  "name": "Dynamic CIP-68 Avatars",
  "definition_status": "complete",
  "policy_ids": [
    "fedcba9876543210fedcba9876543210fedcba9876543210fedcba98"
  ],
  "identity": {
    "display_name": {
      "value": "Dynamic CIP-68 Avatars"
    },
    "description": {
      "value": "CIP-68 reference NFT collection with updatable datum and off-chain metadata."
    },
    "category": {
      "value": "gaming"
    },
    "tags": ["cip68", "dynamic", "avatars"]
  },
  "metadata_layout": {
    "primary_standard": "cip68",
    "metadata_root": "$",
    "asset_name_encoding": "hex",
    "cip25": {
      "label": "721",
      "policy_path": "$.721.<policy_id>",
      "asset_metadata_path": "$.721.<policy_id>.<asset_name>"
    },
    "cip68": {
      "enabled": true,
      "datum_path": "$.datum",
      "reference_token_pattern": "^000643b0"
    },
    "custom": {
      "description": "Extended traits may appear in off-chain JSON under extra_traits."
    }
  },
  "trait_mappings": [
    {
      "canonical_trait": "Skin",
      "display_name": "Skin",
      "value_type": "enum",
      "category": "visual",
      "required": false,
      "dynamic": true,
      "source": "cip68",
      "source_paths": [
        "$.extra_traits.Skin",
        "$.datum.extra_traits.Skin"
      ],
      "allowed_values": ["Light", "Dark", "Alien"]
    },
    {
      "canonical_trait": "Level",
      "display_name": "Level",
      "value_type": "integer",
      "category": "stats",
      "required": false,
      "dynamic": true,
      "source": "cip68",
      "source_paths": [
        "$.extra_traits.Level",
        "$.datum.extra_traits.Level"
      ]
    }
  ],
  "media_mappings": {
    "image": {
      "source_path": "$.image",
      "source": "cip68"
    },
    "animation": {
      "source_path": "$.animation_url",
      "source": "cip68"
    },
    "logo": {
      "value": "https://example.com/cip68-avatars/logo.svg",
      "source": "registry"
    },
    "banner": {
      "value": "https://example.com/cip68-avatars/banner.webp",
      "source": "registry"
    }
  },
  "social_mappings": {
    "github": {
      "value": "https://github.com/example/cip68-avatars",
      "source": "registry"
    },
    "telegram": {
      "value": null,
      "source_path": "$.project.telegram",
      "source": "custom"
    }
  },
  "link_mappings": {
    "documentation": {
      "value": "https://example.com/cip68-avatars/docs",
      "source": "registry"
    },
    "game": {
      "source_path": "$.project.game_url",
      "source": "custom"
    }
  },
  "external_resources": [
    {
      "type": "metadata_manifest",
      "label": "Metadata Manifest",
      "uri": "https://metadata.example.com/cip68/manifest.json",
      "hash": null,
      "notes": "Off-chain manifest referenced from reference token datum"
    }
  ],
  "license_info": {
    "license": {
      "value": "Proprietary",
      "source": "registry"
    },
    "commercial_use": {
      "value": false,
      "source": "registry"
    }
  },
  "royalty_info": {
    "has_royalties": true,
    "source": "marketplace",
    "royalty_percentage": {
      "value": 2.5,
      "source": "registry"
    },
    "notes": "Marketplace-reported royalty; verify against on-chain CIP-27 if available"
  },
  "normalization_rules": [],
  "indexing_notes": [
    {
      "severity": "critical",
      "message": "Distinguish reference tokens (asset name prefix 000643b0) from user tokens when indexing."
    },
    {
      "severity": "warning",
      "message": "Trait values can change over time; consumers should not cache traits indefinitely."
    }
  ]
}
