{
  "registry_version": "1.0.0",
  "collection_id": "eikonikos-genesis-passports",
  "name": "EIKONIKOS - Genesis Passports",
  "definition_status": "partial",
  "policy_ids": [
    "d1b21921e3cc1b7559c2691365ab3b9b1e495e1b0391213b71577430"
  ],
  "identity": {
    "display_name": {
      "value": "EIKONIKOS - Genesis Passports"
    },
    "description": {
      "value": ""
    }
  },
  "metadata_layout": {
    "primary_standard": "unknown",
    "metadata_root": "$",
    "asset_name_encoding": "unknown"
  },
  "trait_mappings": [],
  "media_mappings": {},
  "social_mappings": {},
  "link_mappings": {},
  "external_resources": [],
  "license_info": {},
  "royalty_info": {},
  "normalization_rules": [],
  "indexing_notes": [
    {
      "severity": "info",
      "message": "Phase 3A Top-100 include_now (TapTools rank 71). Type: event. Discovery only — no final definition in this pass."
    }
  ]
}
