{
  "registry_version": "1.0.0",
  "collection_id": "goofy-gophers-mining-club",
  "name": "Goofy Gophers Mining Club",
  "definition_status": "partial",
  "policy_ids": [
    "075bc45055274a362eb5d0d86090f39ca269b5bd22abbce99d3e4a81"
  ],
  "identity": {
    "display_name": {
      "value": "Goofy Gophers Mining Club"
    },
    "description": {
      "value": ""
    }
  },
  "metadata_layout": {
    "primary_standard": "unknown",
    "metadata_root": "$",
    "asset_name_encoding": "unknown"
  },
  "trait_mappings": [],
  "media_mappings": {},
  "social_mappings": {},
  "link_mappings": {},
  "external_resources": [],
  "license_info": {},
  "royalty_info": {},
  "normalization_rules": [],
  "indexing_notes": [
    {
      "severity": "info",
      "message": "Phase 3A Top-100 include_now (TapTools rank 21). Type: gaming. Discovery only — no final definition in this pass."
    }
  ]
}
