{
  "registry_version": "1.0.0",
  "collection_id": "genesis-collector",
  "name": "Genesis Collector",
  "definition_status": "partial",
  "policy_ids": [
    "8e0556c569082f195b406737647765ed6b05d27dcb2c65319b7ce391"
  ],
  "identity": {
    "display_name": {
      "value": "Genesis Collector"
    },
    "description": {
      "value": ""
    }
  },
  "metadata_layout": {
    "primary_standard": "unknown",
    "metadata_root": "$",
    "asset_name_encoding": "unknown"
  },
  "trait_mappings": [],
  "media_mappings": {},
  "social_mappings": {},
  "link_mappings": {},
  "external_resources": [],
  "license_info": {},
  "royalty_info": {},
  "normalization_rules": [],
  "indexing_notes": [
    {
      "severity": "info",
      "message": "Phase 3A Top-100 include_now (TapTools rank 72). Type: event. Discovery only — no final definition in this pass."
    }
  ]
}
