{
  "registry_version": "1.0.0",
  "collection_id": "magic-kongs",
  "name": "Magic Kongs",
  "definition_status": "partial",
  "policy_ids": [
    "2eeb39204c3d104b40ec56bfd612bb1067fdea45de15f3a8aad9db71"
  ],
  "identity": {
    "display_name": {
      "value": "Magic Kongs"
    },
    "description": {
      "value": ""
    }
  },
  "metadata_layout": {
    "primary_standard": "unknown",
    "metadata_root": "$",
    "asset_name_encoding": "unknown"
  },
  "trait_mappings": [],
  "media_mappings": {},
  "social_mappings": {},
  "link_mappings": {},
  "external_resources": [],
  "license_info": {},
  "royalty_info": {},
  "normalization_rules": [],
  "indexing_notes": [
    {
      "severity": "info",
      "message": "Phase 3A Top-100 include_now (TapTools rank 70). Type: gaming. Discovery only — no final definition in this pass."
    }
  ]
}
