{
  "registry_version": "1.0.0",
  "collection_id": "hosky-c-ash-grab-nft",
  "name": "HOSKY C(ash grab)NFT",
  "definition_status": "partial",
  "policy_ids": [
    "a5bb0e5bb275a573d744a021f9b3bff73595468e002755b447e01559"
  ],
  "identity": {
    "display_name": {
      "value": "HOSKY C(ash grab)NFT"
    },
    "description": {
      "value": ""
    }
  },
  "metadata_layout": {
    "primary_standard": "unknown",
    "metadata_root": "$",
    "asset_name_encoding": "unknown"
  },
  "trait_mappings": [],
  "media_mappings": {},
  "social_mappings": {},
  "link_mappings": {},
  "external_resources": [],
  "license_info": {},
  "royalty_info": {},
  "normalization_rules": [],
  "indexing_notes": [
    {
      "severity": "info",
      "message": "Phase 3A Top-100 include_now (TapTools rank 20). Type: utility. Discovery only — no final definition in this pass."
    }
  ]
}
