{
  "registry_version": "1.0.0",
  "collection_id": "basic-cip25-pfp",
  "name": "Basic CIP-25 PFP",
  "definition_status": "complete",
  "policy_ids": [
    "f0100000000000000000000000000000000000000000000000000000"
  ],
  "identity": {
    "display_name": { "value": "Basic CIP-25 PFP" },
    "description": {
      "value": "Spec example: standard CIP-25 attributes object for a profile-picture collection."
    },
    "category": { "value": "pfp" },
    "tags": ["pfp", "spec-example", "cip25"]
  },
  "metadata_layout": {
    "primary_standard": "cip25",
    "metadata_root": "$",
    "asset_name_encoding": "utf8",
    "cip25": {
      "label": "721",
      "policy_path": "$.721.<policy_id>",
      "asset_metadata_path": "$.721.<policy_id>.<asset_name>"
    },
    "cip68": {
      "enabled": false,
      "datum_path": null,
      "reference_token_pattern": null
    }
  },
  "trait_mappings": [
    {
      "canonical_trait": "Background",
      "display_name": "Background",
      "value_type": "enum",
      "category": "visual",
      "required": false,
      "source": "cip25",
      "source_paths": ["$.attributes.Background"],
      "extraction": {
        "strategy": "direct_path",
        "source_path": "$.attributes.Background"
      },
      "allowed_values": ["Blue", "Red", "Green"],
      "normalization": {
        "blue": "Blue",
        "red": "Red",
        "green": "Green"
      }
    },
    {
      "canonical_trait": "Eyes",
      "display_name": "Eyes",
      "value_type": "string",
      "category": "visual",
      "source": "cip25",
      "extraction": {
        "strategy": "direct_path",
        "source_path": "$.attributes.Eyes"
      }
    }
  ],
  "media_mappings": {
    "image": {
      "source_path": "$.image",
      "source": "cip25"
    },
    "banner": {
      "value": "https://example.com/banner.png",
      "source": "registry"
    },
    "logo": {
      "value": "https://example.com/logo.png",
      "source": "registry"
    }
  },
  "social_mappings": {
    "x": {
      "value": "https://x.com/example",
      "source": "registry"
    },
    "discord": {
      "value": "https://discord.gg/example",
      "source": "registry"
    }
  },
  "link_mappings": {
    "website": {
      "value": "https://example.com",
      "source": "registry"
    }
  },
  "external_resources": [],
  "license_info": {},
  "royalty_info": {
    "has_royalties": false,
    "source": "unknown"
  },
  "normalization_rules": [],
  "indexing_notes": []
}
